{"$schema":"https://json-schema.org/draft/2020-12/schema","type":"object","additionalProperties":false,"required":["rule_id","jurisdiction","topic","publication_date","effective_from","effective_to","tax_year","transition_refs","future_announced","lifecycle_status","source_id","source_version","retrieved_at","freshness_class","description"],"properties":{"rule_id":{"type":"string"},"jurisdiction":{"enum":["HU","EU","NON_EU","MULTI"]},"topic":{"type":"string"},"publication_date":{"type":["string","null"],"format":"date"},"effective_from":{"type":["string","null"],"format":"date"},"effective_to":{"type":["string","null"],"format":"date","description":"Exclusive upper boundary."},"tax_year":{"type":["integer","null"],"minimum":2000,"maximum":2100},"transition_refs":{"type":"array","items":{"type":"string"}},"future_announced":{"type":"boolean"},"lifecycle_status":{"enum":["proposed","enacted_not_effective","effective","superseded","historical"]},"source_id":{"type":["string","null"]},"source_version":{"type":["string","null"]},"retrieved_at":{"type":["string","null"],"format":"date"},"freshness_class":{"enum":["STATIC_HISTORICAL","LOW_CHANGE","ANNUAL_REVIEW","HIGH_CHANGE","LIVE_VERIFICATION_REQUIRED"]},"description":{"type":"string"}}}