{"rule_id":"synthetic-aam-rule-fixture-2026","jurisdiction":"HU","topic":"AAM threshold example","publication_date":"2025-12-11","effective_from":"2026-01-01","effective_to":"2027-01-01","tax_year":2026,"transition_refs":["Áfa tv. 377. § transition must be checked separately"],"future_announced":false,"lifecycle_status":"effective","source_id":"hu-nav-aam-2026-guidance","source_version":"2025-12-11","retrieved_at":"2026-10-08","freshness_class":"ANNUAL_REVIEW","description":"Synthetic rule-record shape fixture only; NAV guidance evidence does not replace statutory verification."}